{
  "id": "netsuite",
  "url": "https://{accountId}.suitetalk.api.netsuite.com/services/mcp/v1/all",
  "name": "NetSuite",
  "landing": { "es": "NetSuite, con la app de tu empresa" },
  "color": "#FFFFFF",
  "tagline": "Records, saved searches and reports",
  "description": "Oracle NetSuite's official MCP server (AI Connector Service), through your company's integration. You sign in with your own NetSuite role and its permissions; writes wait for your approval.",
  "settings": [
    { "field": "accountId", "fills": "url" },
    { "field": "clientId", "variable": "MCP_FIXED_CLIENT_ID" }
  ],
  "trustedLogin": []
}
